The reason for which I couldn't attend the meeting was a family emergency.,La razón por la cual no pude asistir a la reunión fue una emergencia familiar.,09/25/2024 01:00:00,5,UNSEEN
"A few minutes ago, I received an important call.","Hace unos minutos, recibí una llamada importante.",09/25/2024 01:00:00,5,UNSEEN
A new problem has appeared in the project.,Ha aparecido un nuevo problema en el proyecto.,09/25/2024 01:00:00,5,UNSEEN
"After finishing the exams, I decided to unleash my creativity.","Después de terminar los exámenes, decidí dar rienda suelta a mi creatividad.",09/25/2024 01:00:00,5,UNSEEN
"After he goes to another office, we will meet.","Después de que vaya a otra oficina, nos reuniremos.",09/25/2024 01:00:00,5,UNSEEN
"After overcoming his fears, he no longer cared about what others might think.","Después de superar sus miedos, ya no le importaba qué pudieran pensar los demás.",09/25/2024 01:00:00,5,UNSEEN
"After playing, the son's mom will clean Max.","Después de jugar, la mamá del hijo limpiará a Max.",09/25/2024 01:00:00,5,UNSEEN
"After so many issues, I want to get rid of this already.","Después de tantos problemas, quiero quitarme ya esto de encima.",09/25/2024 01:00:00,5,UNSEEN
"After so much practice, I know it by heart now.","Después de tanto practicar, ahora lo sé de memoria.",09/25/2024 01:00:00,5,UNSEEN
"After the explanation, it's clear to me that we need to take action.","Después de la explicación, me queda claro que debemos actuar.",09/25/2024 01:00:00,5,UNSEEN
"After the sale, only a few units were left.","Después de la venta, solo quedaban algunas unidades.",09/25/2024 01:00:00,5,UNSEEN
"After trying it several times, he realized it was pointless to continue.","Luego de intentarlo varias veces, se dio cuenta de que no tenía caso continuar.",09/25/2024 01:00:00,5,UNSEEN
All the students sang in unison during the school event.,Todos los estudiantes cantaron al unísono durante el evento escolar.,09/25/2024 01:00:00,5,UNSEEN
"Already in the early morning, we decided to go home.","Ya de madrugada, decidimos irnos a casa.",09/25/2024 01:00:00,5,UNSEEN
"Although in the background, his contribution was crucial.","Aunque estaba en segundo plano, su contribución fue crucial.",09/25/2024 01:00:00,5,UNSEEN
"Although we were already tired, we decided to walk even more to reach our destination.","Aunque ya estábamos cansados, decidimos caminar todavía más para llegar al destino.",09/25/2024 01:00:00,5,UNSEEN
"Apparently, he won't make it to the meeting on time.","Al parecer, no llegará a tiempo para la reunión.",09/25/2024 01:00:00,5,UNSEEN
"Are you going to quit? No way, I'm not even considering it!","¿Vas a renunciar? ¡Qué va, ni siquiera lo estoy considerando!",09/25/2024 01:00:00,5,UNSEEN
"As an artist, it's important to make oneself known in different places.","Como artista, es importante darse a conocer en diferentes lugares.",09/25/2024 01:00:00,5,UNSEEN
"As far as I know, the project is going well.","Hasta donde sé, el proyecto va bien.",09/25/2024 01:00:00,5,UNSEEN
"As for the project, there are some concerns.","En cuanto al proyecto, hay algunas preocupaciones.",09/25/2024 01:00:00,5,UNSEEN
"As I was saying before, the situation is complicated.","Como te comentaba antes, la situación es complicada.",09/25/2024 01:00:00,5,UNSEEN
"As part of my routine, I wake up at six every morning.","Como parte de mi rutina, me levanto a las seis todas las mañanas.",09/25/2024 01:00:00,5,UNSEEN
"As the day progressed, the heat became more intense.","Conforme avanzaba el día, el calor se volvía más intenso.",09/25/2024 01:00:00,5,UNSEEN
"As the holidays approached, excitement grew in the air.","Conforme se acercaban las vacaciones, la emoción crecía en el aire.",09/25/2024 01:00:00,5,UNSEEN
"At first, he didn't take the challenge seriously.","Al principio, no se había tomado en serio el desafío.",09/25/2024 01:00:00,5,UNSEEN
"At the conference, they also talked about advances in medical research.","En la conferencia, se hablaba también de los avances en la investigación médica.",09/25/2024 01:00:00,5,UNSEEN
"At the party, there were no shortage of fun moments.","En la fiesta, no faltaron los momentos divertidos.",09/25/2024 01:00:00,5,UNSEEN
"Before answering, he thinks about it for a minute.","Antes de responder, él lo piensa durante un minuto.",09/25/2024 01:00:00,5,UNSEEN
"Before going out, make sure to apply sunscreen.","Antes de salir, asegúrate de aplicar bloqueador solar.",09/25/2024 01:00:00,5,UNSEEN
"Before going out, she applied red lipstick to stand out.","Antes de salir, se aplicó lápiz labial rojo para destacar.",09/25/2024 01:00:00,5,UNSEEN
"Before going shopping, make a list of what you really need.","Antes de ir de compras, haz una lista de lo que realmente necesitas.",09/25/2024 01:00:00,5,UNSEEN
"Before making a decision, take it into account.","Antes de tomar una decisión, tenlo en cuenta.",09/25/2024 01:00:00,5,UNSEEN
"Before serving the wine, he took a sip to make sure it was good.","Antes de servir el vino, probó un sorbo para asegurarse de que estuviera bueno.",09/25/2024 01:00:00,5,UNSEEN
"Before sleeping, I always like to floss.","Antes de dormir, siempre me gusta pasarme hilo dental.",09/25/2024 01:00:00,5,UNSEEN
"Before you leave, can I ask you a quick question?","Antes de que te vayas, ¿puedo hacerte una pregunta rápida?",09/25/2024 01:00:00,5,UNSEEN
"Being punctual is a sign of respect, which translates into a more positive work environment.","Ser puntual es una muestra de respeto, lo que se traduce en un ambiente laboral más positivo.",09/25/2024 01:00:00,5,UNSEEN
Bright colors were mixed with softer tones in the painting.,Los colores brillantes se mezclados con tonos más suaves en la pintura.,09/25/2024 01:00:00,5,UNSEEN
"But of course, there are always options available.","Pero claro, siempre hay opciones disponibles.",09/25/2024 01:00:00,5,UNSEEN
"By making an effort, he managed to reach the top of the mountain.","Al hacer esfuerzo, logró alcanzar la cima de la montaña.",09/25/2024 01:00:00,5,UNSEEN
Can you make it even easier?,¿Puedes hacerlo más fácil todavía?,09/25/2024 01:00:00,5,UNSEEN
Cook the stew over low heat for it to be delicious.,Cocina el guiso a fuego lento para que quede sabroso.,09/25/2024 01:00:00,5,UNSEEN
Daily routine is part of everyday life.,La rutina diaria forma parte de la vida cotidiana.,09/25/2024 01:00:00,5,UNSEEN
"Deep down, we all want to be happy.","En el fondo, todos queremos ser felices.",09/25/2024 01:00:00,5,UNSEEN
Dental floss is crucial for maintaining good oral health.,El hilo dental es crucial para mantener una buena salud bucal.,09/25/2024 01:00:00,5,UNSEEN
"Despite being polar opposites in personality, they work well together as a team.","Aunque sean polos opuestos en personalidad, trabajan bien juntos como equipo.",09/25/2024 01:00:00,5,UNSEEN
"Despite the challenges being significant, he didn't want to give up.","Aunque las dificultades eran grandes, no se quería dar por vencido.",09/25/2024 01:00:00,5,UNSEEN
"Despite the explanation, he will keep thinking about the problem.","A pesar de la explicación, seguirá pensando en el problema.",09/25/2024 01:00:00,5,UNSEEN
"Despite the noise, he didn't even move; he was sound asleep.","A pesar del ruido, él ni se movió; estaba profundamente dormido.",09/25/2024 01:00:00,5,UNSEEN
"Despite the sadness, she held back the tears.","A pesar de la tristeza, aguantó las lágrimas.",09/25/2024 01:00:00,5,UNSEEN
"Despite the warnings, he continued to ignore it.","A pesar de las advertencias, siguió haciendo caso omiso.",09/25/2024 01:00:00,5,UNSEEN
Did you realize you forgot your phone?,Te diste cuenta de que olvidaste tu teléfono.,09/25/2024 01:00:00,5,UNSEEN
Do me the favor of closing the door when you leave.,Hazme el favor de cerrar la puerta al salir.,09/25/2024 01:00:00,5,UNSEEN
Do you want me to give you a hand with the groceries?,¿Quieres que te dé una mano con las compras?,09/25/2024 01:00:00,5,UNSEEN
Don't lose sight of your goals.,No pierdas de vista tus metas.,09/25/2024 01:00:00,5,UNSEEN
"Don't play innocent, I know you know.","No te hagas el inocente, sé que lo sabes.",09/25/2024 01:00:00,5,UNSEEN
Don't worry about that issue. I've already taken care of it.,No te preocupes por ese asunto. Ya me encargué de ello.,09/25/2024 01:00:00,5,UNSEEN
"Don't worry, take it easy, everything will be fine.","No te preocupes, tómalo con calma, todo estará bien.",09/25/2024 01:00:00,5,UNSEEN
Don't worry; everything is already resolved.,"No te preocupes, ya está todo solucionado.",09/25/2024 01:00:00,5,UNSEEN
"During the interview, he asks her some questions about her experience.","Durante la entrevista, le hace algunas preguntas sobre su experiencia.",09/25/2024 01:00:00,5,UNSEEN
Enjoy every moment because time flies.,Disfruta cada momento porque el tiempo vuela.,09/25/2024 01:00:00,5,UNSEEN
"Even better, we could finish earlier than expected.","Mejor aún, podríamos terminar antes de lo previsto.",09/25/2024 01:00:00,5,UNSEEN
"Even if it's a small step, it's progress.","Aunque sea un pequeño paso, es progreso.",09/25/2024 01:00:00,5,UNSEEN
"Even if it's not perfect, it will be good enough.","Aunque no sea perfecto, será lo suficientemente bueno.",09/25/2024 01:00:00,5,UNSEEN
"Even if you ignore the rumors, they will keep talking.","Aunque ignores los rumores, seguirán hablando.",09/25/2024 01:00:00,5,UNSEEN
"Even though I was tired, I kept working.","Aún y cuando estaba cansado, continué trabajando.",09/25/2024 01:00:00,5,UNSEEN
Everyone has their own learning style.,Cada uno tiene su propio estilo de aprender.,09/25/2024 01:00:00,5,UNSEEN
Everyone is busy with their own things; it's challenging to coordinate all the schedules.,Cada uno está ocupado a lo suyo; es difícil coordinar todos los horarios.,09/25/2024 01:00:00,5,UNSEEN
"Everything happened in slow motion, as if time stood still.","Todo sucedió en cámara lenta, como si el tiempo se detuviera.",09/25/2024 01:00:00,5,UNSEEN
Explain to me what it means to be a good leader.,Explícame qué es ser un buen líder.,09/25/2024 01:00:00,5,UNSEEN
"Faced with disrespect, the teacher stopped them immediately.","Ante la falta de respeto, el profesor les puso un alto de inmediato.",09/25/2024 01:00:00,5,UNSEEN
"Faced with the difficult question, he shrugged without saying anything.","Ante la pregunta difícil, se encogió de hombros sin decir nada.",09/25/2024 01:00:00,5,UNSEEN
"Faced with the flight cancellation, there was no choice but to look for an alternative.","Ante la cancelación del vuelo, no tuvo remedio más que buscar una alternativa.",09/25/2024 01:00:00,5,UNSEEN
"Faced with the situation, he had no choice but to apologize.","Ante la situación, no tuvo más remedio que pedir disculpas.",09/25/2024 01:00:00,5,UNSEEN
Fashion trends come and go quickly; some clothes will go out of style soon.,Las tendencias de moda pasan rápidamente; algunas prendas pasarán de moda en poco tiempo.,09/25/2024 01:00:00,5,UNSEEN
Fermi's paradox raises fascinating questions about the existence of extraterrestrial life.,La paradoja de Fermi plantea preguntas fascinantes sobre la existencia de vida extraterrestre.,09/25/2024 01:00:00,5,UNSEEN
Finding that information on the Internet is like looking for a needle in a haystack.,Encontrar esa información en Internet es como buscar una aguja en un pajar.,09/25/2024 01:00:00,5,UNSEEN
Fingerprint technology has improved security.,La tecnología de huella digital ha mejorado la seguridad.,09/25/2024 01:00:00,5,UNSEEN
"For the most part, the event was a success thanks to everyone's collaboration.","En su mayor parte, el evento fue un éxito gracias a la colaboración de todos.",09/25/2024 01:00:00,5,UNSEEN
"Fortunately, the car is in good condition.","Afortunadamente, el coche está en buen estado.",09/25/2024 01:00:00,5,UNSEEN
"From here, I can see the horizon.",Desde aquí alcanzo a ver el horizonte.,09/25/2024 01:00:00,5,UNSEEN
"From that point on, everything changed in my life.","A partir de ahí, todo cambió en mi vida.",09/25/2024 01:00:00,5,UNSEEN
"From the square, you can see the bell tower.","Desde la plaza, se puede ver la torre del campanario.",09/25/2024 01:00:00,5,UNSEEN
"From today on, we will implement new policies.","A partir de hoy, implementaremos nuevas políticas.",09/25/2024 01:00:00,5,UNSEEN
He backed out at the last moment and decided not to participate in the competition.,Se echó para atrás en el último momento y decidió no participar en la competición.,09/25/2024 01:00:00,5,UNSEEN
He barely managed to finish the race due to a leg injury.,Logró completar la carrera a duras penas debido a una lesión en la pierna.,09/25/2024 01:00:00,5,UNSEEN
He completed the task without a doubt about his ability.,Realizó el trabajo sin darle lugar a dudas de su habilidad.,09/25/2024 01:00:00,5,UNSEEN
He could not have done that by himself; someone helped him.,No pudo haber hecho eso por sí mismo; alguien le ayudó.,09/25/2024 01:00:00,5,UNSEEN
"He couldn't resist the offer, and there were plenty of reasons to accept.","No pudo resistirse a la oferta, y razones sobraban para aceptar.",09/25/2024 01:00:00,5,UNSEEN
He did whatever he wanted without caring about the consequences.,Hizo lo que quiso sin importarle las consecuencias.,09/25/2024 01:00:00,5,UNSEEN
"He didn't like the decision, and he mumbled it under his breath.","No le gustó la decisión, y lo comentó entre dientes.",09/25/2024 01:00:00,5,UNSEEN
He doesn't have any free time on Mondays because of his job.,Él no tiene ningún tiempo libre los lunes debido a su trabajo.,09/25/2024 01:00:00,5,UNSEEN
He fixed his gaze on the horizon while reflecting on his decisions.,Clavó la mirada en el horizonte mientras reflexionaba sobre sus decisiones.,09/25/2024 01:00:00,5,UNSEEN
He had not noticed the presence of the visitor.,No se había percatado de la presencia del visitante.,09/25/2024 01:00:00,5,UNSEEN
He had to go to another office later for a meeting.,Tuvo que ir luego a otra oficina para una reunión.,09/25/2024 01:00:00,5,UNSEEN
He has always liked classical music.,Siempre le ha gustado la música clásica.,09/25/2024 01:00:00,5,UNSEEN
He has to look professional for the job interview.,Él tiene que verse profesional para la entrevista de trabajo.,09/25/2024 01:00:00,5,UNSEEN
"He made an effort; however, he did not achieve the desired result.","Hizo un esfuerzo, no obstante, no logró el resultado deseado.",09/25/2024 01:00:00,5,UNSEEN
He makes the same mistake over and over again.,Comete el mismo error una y otra vez.,09/25/2024 01:00:00,5,UNSEEN
"He pretended to be an expert on the subject, but he didn't know much.","Se hacía pasar por un experto en el tema, pero no sabía mucho.",09/25/2024 01:00:00,5,UNSEEN
He ran so fast that he barely managed to see the train.,Corrió tan rápido que apenas alcanzó a ver el tren.,09/25/2024 01:00:00,5,UNSEEN
"He took responsibility, and as such, he led the project.","Asumió la responsabilidad y como tal, lideró el proyecto.",09/25/2024 01:00:00,5,UNSEEN
He took the opposite direction and got lost.,Tomó el rumbo contrario y se perdió.,09/25/2024 01:00:00,5,UNSEEN
"He tried to convince him, and it was of no use.","Intentó convencerlo, y no sirvió de nada.",09/25/2024 01:00:00,5,UNSEEN
"He was about to achieve it, but something went wrong.","Estuvo a punto de lograrlo, pero algo salió mal.",09/25/2024 01:00:00,5,UNSEEN
He was forced to resign due to unexpected circumstances.,Se vio forzado a renunciar debido a las circunstancias inesperadas.,09/25/2024 01:00:00,5,UNSEEN
He's her best friend; she would never let him go in tough times.,Es su mejor amigo; jamás lo soltaría en momentos difíciles.,09/25/2024 01:00:00,5,UNSEEN
"He/she always does things his/her way, without asking anyone.","Siempre hace las cosas a su bola, sin preguntar a nadie.",09/25/2024 01:00:00,5,UNSEEN
"He/she says he/she agrees, but it's just lip service.","Dice que está de acuerdo, pero es solo de boquilla.",09/25/2024 01:00:00,5,UNSEEN
He/she will have to make a tough decision at work.,Tendrá que tomar una decisión difícil en el trabajo.,09/25/2024 01:00:00,5,UNSEEN
His answer has left me uneasy all night.,Su respuesta me ha dejado inquieto toda la noche.,09/25/2024 01:00:00,5,UNSEEN
His comment kept me awake all night.,Su comentario me ha quitado el sueño toda la noche.,09/25/2024 01:00:00,5,UNSEEN
His happiness was evident to everyone.,Su felicidad saltaba a la vista de todos.,09/25/2024 01:00:00,5,UNSEEN
His kindness made him feel welcome.,Su amabilidad le hizo sentir bienvenido.,09/25/2024 01:00:00,5,UNSEEN
His strange behavior gave a bad feeling to his friends.,Su comportamiento extraño dio mala espina a sus amigos.,09/25/2024 01:00:00,5,UNSEEN
His words hurt like a knife in the chest.,Sus palabras hirieron como un cuchillo en el pecho.,09/25/2024 01:00:00,5,UNSEEN
How did Rosa travel to arrive so quickly?,¿En qué viajó Rosa para llegar tan rápido?,09/25/2024 01:00:00,5,UNSEEN
How often do you exercise?,¿Con qué frecuencia haces ejercicio?,09/25/2024 01:00:00,5,UNSEEN
How the hell did we end up in this complicated situation?,¿Cómo coño llegamos a esta situación tan complicada?,09/25/2024 01:00:00,5,UNSEEN
I agree. I say the same thing.,Tu idea es genial. Lo mismo digo.,09/25/2024 01:00:00,5,UNSEEN
I can't believe he's pulling my leg with that unbelievable story.,No puedo creer que me esté tomando el pelo con esa historia increíble.,09/25/2024 01:00:00,5,UNSEEN
I can't find the water key to shut off the pipe.,No encuentro la llave del agua para apagar la tubería.,09/25/2024 01:00:00,5,UNSEEN
I couldn't help but feel sadness for his departure.,No podía dejar de sentir tristeza por su partida.,09/25/2024 01:00:00,5,UNSEEN
I didn't even try to solve the problem because it was too difficult.,Ni siquiera intenté resolver el problema porque era demasiado difícil.,09/25/2024 01:00:00,5,UNSEEN
I didn't know what could happen after making that decision.,No sabía qué pudiera pasar después de tomar esa decisión.,09/25/2024 01:00:00,5,UNSEEN
I didn't realize how important it was until I lost it.,Yo no me daba cuenta de lo importante que era hasta que lo perdí.,09/25/2024 01:00:00,5,UNSEEN
"I didn't say anything, but I told the others that I would be a little late.","No dije nada, pero di a los demás que llegaría un poco tarde.",09/25/2024 01:00:00,5,UNSEEN
I do it for the record that I don't agree.,Lo hago para que conste que no estoy de acuerdo.,09/25/2024 01:00:00,5,UNSEEN
I don't give a damn about that person's opinion.,La opinión de esa persona me importa un carajo.,09/25/2024 01:00:00,5,UNSEEN
"I don't have to explain my reasons to you, but I will anyway.","No tengo por qué explicarte mis razones, pero lo haré de todos modos.",09/25/2024 01:00:00,5,UNSEEN
I don't know what else Andrés will do on Friday.,No sé qué más hará Andrés el viernes.,09/25/2024 01:00:00,5,UNSEEN
"I don't know what he had in mind, but he seemed excited about the surprise.","No sé qué se traía entre manos, pero parecía emocionado por la sorpresa.",09/25/2024 01:00:00,5,UNSEEN
I don't know what Max is doing right now.,No sé qué estará haciendo Max en este momento.,09/25/2024 01:00:00,5,UNSEEN
I don't know why Felipe's sister will start studying.,No sé para qué comenzará a estudiar la hermana de Felipe.,09/25/2024 01:00:00,5,UNSEEN
"I don't remember what you were telling me about that book, can you recall it?","No recuerdo lo que me decías sobre ese libro, ¿puedes recordarlo?",09/25/2024 01:00:00,5,UNSEEN
"I don't think I can help you, much less solve the problem.","No creo que pueda ayudarte, mucho menos resolver el problema.",09/25/2024 01:00:00,5,UNSEEN
I don't think it will work for so long.,No creo que funcione por tanto tiempo.,09/25/2024 01:00:00,5,UNSEEN
I don't think that approach will work to solve the problem.,No creo que funcione ese enfoque para resolver el problema.,09/25/2024 01:00:00,5,UNSEEN
"I don't understand his actions, but I guess that would be his way of expressing himself.","No entiendo sus acciones, pero supongo que esa sería su manera de expresarse.",09/25/2024 01:00:00,5,UNSEEN
I don't understand how he knew that we were going to need help.,No entiendo cómo supo que íbamos a necesitar ayuda.,09/25/2024 01:00:00,5,UNSEEN
I don't understand how we ended up in this situation.,No entiendo cómo fue que llegamos a esta situación.,09/25/2024 01:00:00,5,UNSEEN
I found him in the supermarket while doing the shopping.,Lo encontraba en el supermercado mientras hacía las compras.,09/25/2024 01:00:00,5,UNSEEN
I found the book by pure chance while cleaning the attic.,Encontré el libro por mera casualidad mientras limpiaba el desván.,09/25/2024 01:00:00,5,UNSEEN
I found the information; there's no need for you to look for it.,"Ya encontré la información, no hace falta que la busques.",09/25/2024 01:00:00,5,UNSEEN
"I hadn't agreed before, but now I understand.","Antes no había estado de acuerdo, pero ahora entiendo.",09/25/2024 01:00:00,5,UNSEEN
I have always wanted to follow in his footsteps and be like him.,Siempre he querido seguir sus pasos y ser como él.,09/25/2024 01:00:00,5,UNSEEN
I have been living in this city for five years.,Llevo viviendo en esta ciudad desde hace cinco años.,09/25/2024 01:00:00,5,UNSEEN
"I help the community. In turn, the community supports me.","Ayudo a la comunidad. A su vez, la comunidad me apoya.",09/25/2024 01:00:00,5,UNSEEN
I hope all the preparations are done on time for the party.,Espero que todos los preparativos se hagan a tiempo para la fiesta.,09/25/2024 01:00:00,5,UNSEEN
I just finished reading that fascinating book you recommended.,Acabo de terminar de leer ese libro fascinante que me recomendaste.,09/25/2024 01:00:00,5,UNSEEN
I know a student who is taking an academic break.,Conozco a un estudiante que se está tomando un descanso académico.,09/25/2024 01:00:00,5,UNSEEN
"I lost my ring on the beach, if you happen to find it, please let me know.","Perdí mi anillo en la playa, si es que lo llegan a encontrar, por favor avísenme.",09/25/2024 01:00:00,5,UNSEEN
"I made a mistake, but what's done is done.","Cometí un error, pero lo hecho hecho está.",09/25/2024 01:00:00,5,UNSEEN
I made them with my own hands.,Los hice con mis propias manos.,09/25/2024 01:00:00,5,UNSEEN
"I must admit, I made a mistake in my report.","Debo reconocerlo, cometí un error en mi informe.",09/25/2024 01:00:00,5,UNSEEN
I myself didn't even know I had that talent.,Ni yo mismo sabía que tenía ese talento.,09/25/2024 01:00:00,5,UNSEEN
I need your help even more than I thought.,Necesito tu ayuda aún más de lo que pensaba.,09/25/2024 01:00:00,5,UNSEEN
"I never expected to say this, but I need help.","Nunca esperé decir esto, pero necesito ayuda.",09/25/2024 01:00:00,5,UNSEEN
I never had clarity on whether to accept the job or not.,Nunca tuve claro si debía aceptar el trabajo o no.,09/25/2024 01:00:00,5,UNSEEN
I plan to go see the new movie this weekend.,Yo pienso ir a ver la nueva película este fin de semana.,09/25/2024 01:00:00,5,UNSEEN
I prepared the food with care. How did it turn out for you?,Preparé la comida con cariño. ¿Cómo les quedó?,09/25/2024 01:00:00,5,UNSEEN
"I swear to him/her, I know nothing about that topic.","Se lo juro, no sé nada sobre ese tema.",09/25/2024 01:00:00,5,UNSEEN
I think it has something to do with the ongoing project.,Creo que tiene algo que ver con el proyecto en curso.,09/25/2024 01:00:00,5,UNSEEN
I think we are being followed; we need to be cautious.,"Creo que nos están siguiendo, debemos ser cautelosos.",09/25/2024 01:00:00,5,UNSEEN
"I told him/her to be careful, but he/she didn't listen.","Le dije que tuviera cuidado, pero no me hizo caso.",09/25/2024 01:00:00,5,UNSEEN
I usually work on weekdays.,Normalmente trabajo los días de semana.,09/25/2024 01:00:00,5,UNSEEN
I want to talk to you about the song you just heard.,Quiero comentarles sobre la canción que acaban de escuchar.,09/25/2024 01:00:00,5,UNSEEN
"I was going to keep the book, but I decided to lend it.","Me iba a quedar con el libro, pero decidí prestarlo.",09/25/2024 01:00:00,5,UNSEEN
I was so focused that I had lost track of time.,Estaba tan concentrado que había perdido noción del tiempo.,09/25/2024 01:00:00,5,UNSEEN
"I was supposed to arrive on time, but there was traffic.","Se suponía que yo llegaría a tiempo, pero hubo tráfico.",09/25/2024 01:00:00,5,UNSEEN
I wasn't present at the crime scene; I'm not guilty.,"No estuve presente en el lugar del crimen, no soy culpable.",09/25/2024 01:00:00,5,UNSEEN
I will call many clients while I am in a meeting.,Llamaré a muchos clientes mientras esté en una reunión.,09/25/2024 01:00:00,5,UNSEEN
I will do everything possible to fulfill my promise.,Haré todo lo posible a como diera lugar para cumplir con mi promesa.,09/25/2024 01:00:00,5,UNSEEN
I will participate in the event as part of the organization.,Participaré en el evento como parte de la organización.,09/25/2024 01:00:00,5,UNSEEN
I worked on that project for so long that I lost track.,Trabajé en ese proyecto por tanto tiempo que perdí la cuenta.,09/25/2024 01:00:00,5,UNSEEN
I would have had to study more to pass the exam.,Hubiera tenido que estudiar más para aprobar el examen.,09/25/2024 01:00:00,5,UNSEEN
"I would have never imagined it, but now everything makes sense.","Jamás me lo hubiera imaginado, pero ahora todo tiene sentido.",09/25/2024 01:00:00,5,UNSEEN
I would like to be the one who organizes the birthday party.,Me gustaría ser yo quien organice la fiesta de cumpleaños.,09/25/2024 01:00:00,5,UNSEEN
