"We started the project, and it didn't take long to see positive results.",Empezamos el proyecto y no tardaron mucho en ver resultados positivos.,09/25/2024 01:00:00,5,UNSEEN
We want to go even further in our goals.,Queremos llegar aún más lejos en nuestras metas.,09/25/2024 01:00:00,5,UNSEEN
We will discuss this later in the meeting.,Discutiremos esto más adelante en la reunión.,09/25/2024 01:00:00,5,UNSEEN
We work alongside our colleagues to achieve the goal.,Trabajamos a la par de nuestros colegas para lograr el objetivo.,09/25/2024 01:00:00,5,UNSEEN
We work with large databases for analysis.,Trabajamos con grandes bases de datos para análisis.,09/25/2024 01:00:00,5,UNSEEN
"We worked hard, and there you go, we achieved our goals.","Trabajamos duro y, ¡ya ves!, alcanzamos nuestras metas.",09/25/2024 01:00:00,5,UNSEEN
We'll have to take measures to prevent future problems.,Habrá que tomar medidas para evitar futuros problemas.,09/25/2024 01:00:00,5,UNSEEN
We'll start investigating now. Here is where things get interesting.,Empezaremos a investigar ahora. Aquí es donde las cosas se ponen interesantes.,09/25/2024 01:00:00,5,UNSEEN
We're almost done with the project; just a few details left.,"Ya casi hemos terminado el proyecto, solo faltan algunos detalles.",09/25/2024 01:00:00,5,UNSEEN
We're making good progress; we're on the path to success.,"Estamos avanzando bien, vamos en camino hacia el éxito.",09/25/2024 01:00:00,5,UNSEEN
What are you up to that you're not responding to my messages?,¿En qué andas metido que no respondes mis mensajes?,09/25/2024 01:00:00,5,UNSEEN
What does this have to do with the project we're working on?,¿Qué tiene que ver esto con el proyecto en el que estamos trabajando?,09/25/2024 01:00:00,5,UNSEEN
What he said doesn't make sense to me; I don't understand his logic.,"Lo que dijo no me hace sentido, no entiendo su lógica.",09/25/2024 01:00:00,5,UNSEEN
What is it that the son has not had in his life?,¿Qué es lo que el hijo no ha tenido en su vida?,09/25/2024 01:00:00,5,UNSEEN
What is this furniture made of? It's very durable.,"De qué está hecho el material de este mueble, es muy resistente.",09/25/2024 01:00:00,5,UNSEEN
What started as a simple project turned into an international success.,Lo que se inició como un simple proyecto se convirtió en un éxito internacional.,09/25/2024 01:00:00,5,UNSEEN
What the hell is this that I found on my desk?,¿Qué mierda es esta que encontré en mi escritorio?,09/25/2024 01:00:00,5,UNSEEN
What you thought could be the opposite of what it really is.,Lo que pensabas pudiera ser al revés de lo que realmente es.,09/25/2024 01:00:00,5,UNSEEN
"When he was a child, what did Max like to do?","Cuando era niño, ¿qué le gustaba hacer a Max?",09/25/2024 01:00:00,5,UNSEEN
"When I go shopping, I always think about buying something new.","Cuando voy de compras, siempre pienso en comprar algo nuevo.",09/25/2024 01:00:00,5,UNSEEN
"When I told him the joke, he burst into laughter.","Al contarle el chiste, soltó una carcajada.",09/25/2024 01:00:00,5,UNSEEN
"When inquiring about the job offer, it was clear that I was interested in the position.","Al preguntar sobre la oferta, fue claro que me interesaba el puesto.",09/25/2024 01:00:00,5,UNSEEN
"When they gave him the news, he jumped for joy.","Cuando le dieron la noticia, saltó de gusto.",09/25/2024 01:00:00,5,UNSEEN
"While driving, they stopped at the red traffic light.","Mientras conducían, hicieron alto en el semáforo en rojo.",09/25/2024 01:00:00,5,UNSEEN
"While you were talking, you didn't even realize that everyone was looking at you in amazement.","Mientras hablaba, tú ni cuenta te diste de que todos te miraban con asombro.",09/25/2024 01:00:00,5,UNSEEN
Why the hell didn't you tell me earlier?,¿Por qué chingados no me dijiste antes?,09/25/2024 01:00:00,5,UNSEEN
"With his skill, he was sure to win the cooking contest.","Con su habilidad, seguro iba a ganar el concurso de cocina.",09/25/2024 01:00:00,5,UNSEEN
"With the lights off, the show is over.","Con las luces apagadas, se acabó el espectáculo.",09/25/2024 01:00:00,5,UNSEEN
"With the necessary time, everything will be resolved.","Con el debido tiempo, todo se resolverá.",09/25/2024 01:00:00,5,UNSEEN
"With the new technology, there will be no place for old methods.","Con la nueva tecnología, ya no habrá lugar para los viejos métodos.",09/25/2024 01:00:00,5,UNSEEN
"With today's technology, they can even do it.","Con la tecnología actual, hoy hasta pueden hacerlo.",09/25/2024 01:00:00,5,UNSEEN
"Witnessing the accident, he couldn't believe what he saw.","Al presenciar el accidente, no podía dar crédito a lo que veía.",09/25/2024 01:00:00,5,UNSEEN
Yesterday I was remembering the last time we saw each other.,Ayer me estaba acordando de la última vez que nos vimos.,09/25/2024 01:00:00,5,UNSEEN
You are more than invited to the birthday party.,Están más que invitados a la fiesta de cumpleaños.,09/25/2024 01:00:00,5,UNSEEN
You can achieve it both with effort and with patience.,Puedes lograrlo tanto con esfuerzo como con paciencia.,09/25/2024 01:00:00,5,UNSEEN
You don't realize how important this is.,No te das cuenta de lo importante que es esto.,09/25/2024 01:00:00,5,UNSEEN
You have some options in mind. What do you suggest then?,Tienes algunas opciones en mente. ¿Qué sugieres entonces?,09/25/2024 01:00:00,5,UNSEEN
You have to do the homework before going out with friends.,Hay que hacer las tareas antes de salir con los amigos.,09/25/2024 01:00:00,5,UNSEEN
"You made a mistake, but don't blame yourself like that; we all make mistakes.","Cometiste un error, pero no te culpes así, todos nos equivocamos.",09/25/2024 01:00:00,5,UNSEEN
You take charge of coordinating the project.,Te haces cargo de la coordinación del proyecto.,09/25/2024 01:00:00,5,UNSEEN
You were lucky that I arrived on time to help you.,Tuviste suerte de que llegara a tiempo para ayudarte.,09/25/2024 01:00:00,5,UNSEEN
You'll have to apologize if you want to resolve the misunderstanding.,Tendrás que disculparte si quieres resolver el malentendido.,09/25/2024 01:00:00,5,UNSEEN
Your attitude makes me think that something is wrong.,Tu actitud me hace pensar que algo está mal.,09/25/2024 01:00:00,5,UNSEEN
